[
  {
    "_id": "mt-ext-SMS-883120",
    "carrierId": "acct-001",
    "sourceKind": "external-feed",
    "source": "SMS",
    "date": "2026-08-14",
    "time": "09:05",
    "driverName": "James Sullivan",
    "driverLicense": "WA-SULLIJ-554",
    "city": "Seattle",
    "state": "WA",
    "country": "USA",
    "ticketNumber": "",
    "citationNumber": "ET-WA-77120",
    "convictionNumber": "",
    "convictionDate": null,
    "violationCode": "393.47(e)",
    "violationDescription": "Clamp or roto-chamber type brake(s) out of adjustment",
    "severity": "Serious",
    "fineAmount": 285,
    "currency": "USD",
    "normalizedRefs": [
      "etwa77120"
    ],
    "matchedTicketId": "tkt-6716b0c1a2b4",
    "dismissedAt": null,
    "dismissedByUserId": null,
    "syncedAt": "2026-08-16T06:00:00Z"
  },
  {
    "_id": "mt-ext-SMS-901244",
    "carrierId": "acct-001",
    "sourceKind": "external-feed",
    "source": "SMS",
    "date": "2026-10-24",
    "time": "07:40",
    "driverName": "Jessica Kelly",
    "driverLicense": "",
    "city": "Columbus",
    "state": "OH",
    "country": "USA",
    "ticketNumber": "",
    "citationNumber": "CT-OH-44876",
    "convictionNumber": "",
    "convictionDate": null,
    "violationCode": "396.3",
    "violationDescription": "Inspection / repair / maintenance not done",
    "severity": "OOS",
    "fineAmount": 0,
    "currency": "USD",
    "normalizedRefs": [
      "ctoh44876"
    ],
    "matchedTicketId": null,
    "dismissedAt": null,
    "dismissedByUserId": null,
    "syncedAt": "2026-10-23T18:00:00Z"
  },
  {
    "_id": "mt-ext-CVOR-CONV-2207",
    "carrierId": "acct-012",
    "sourceKind": "external-feed",
    "source": "CVOR-CONV",
    "date": "2026-04-19",
    "time": null,
    "driverName": "Luc Gagnon",
    "driverLicense": "G0012-34567-89012",
    "city": "Kingston",
    "state": "ON",
    "country": "CA",
    "ticketNumber": "",
    "citationNumber": "",
    "convictionNumber": "CONV-ON-22071",
    "convictionDate": "2026-06-30",
    "violationCode": "HTA 128",
    "violationDescription": "Speeding",
    "severity": "Serious",
    "fineAmount": 195,
    "currency": "CAD",
    "normalizedRefs": [
      "convon22071"
    ],
    "matchedTicketId": null,
    "dismissedAt": null,
    "dismissedByUserId": null,
    "syncedAt": "2026-07-02T06:00:00Z"
  },
  {
    "_id": "mt-viol-v-001-0187",
    "carrierId": "acct-001",
    "sourceKind": "violation",
    "source": "VIOL-LOG",
    "date": "2026-09-28",
    "time": "13:15",
    "driverName": "Ethan Evans",
    "driverLicense": "",
    "city": "Baltimore",
    "state": "MD",
    "country": "USA",
    "ticketNumber": "TKT-MD-11873",
    "citationNumber": "",
    "convictionNumber": "",
    "convictionDate": null,
    "violationCode": "393.9",
    "violationDescription": "Inoperable required lamp",
    "severity": "Minor",
    "fineAmount": 120,
    "currency": "USD",
    "normalizedRefs": [
      "tktmd11873"
    ],
    "matchedTicketId": null,
    "dismissedAt": "2026-10-21T12:00:00Z",
    "dismissedByUserId": "usr-0002",
    "syncedAt": "2026-09-29T06:00:00Z"
  }
]